{
  "candidate": {
    "candidateId": "rimeflow-yolov8n-android-litert-fp32-794e17d9a279",
    "manifestSha256": "365567e382a6edfb590ee9caae4dc290d4d320e2c2151b064761e7a7770b8ed5",
    "reportSha256": "f18dca9363ae30fc76888ee290d8da6d27677776834998dffecb94d523daeab7",
    "runnerBundleId": "sha256-0c309e3f63aa69920a1ac55a42b0a5211771671bf7df0fa180205550ce535866",
    "runnerCommit": "52c85ec737dc4b4ab482f6c2654f914150c4dfae",
    "sourceCheckpointSha256": "f59b3d833e2ff32e194b5bb8e08d211dc7c5bdf144b90d2c8412c47ccfc83b36",
    "tfliteSha256": "794e17d9a2795084787e5125bcfada6cb501c6afc4f708e7e58e96fd8dc84be1",
    "validationCommit": "c7bca1cdc1235bbb294c0e40cdfcfacfdc95a660"
  },
  "deviceEvidence": {
    "dispatchId": "ctx_67518c7c38fb",
    "evidenceManifest": {
      "path": "evidence-manifest.json",
      "sha256": "bc7ab86c8afc89b019ed3831fdad0a23ec9b2d15d8ec2c9adba6d765a5b322ff"
    },
    "executionSummary": {
      "path": "execution-summary.json",
      "sha256": "0f45ab0fbe30d0017b6c70c5e43e04a17838d89dd947ccecbf7a0c0f8f2337db"
    },
    "immutableRootId": ".device-evidence/rfb-android-device-accept-02",
    "manifestParity": {
      "actualFileCount": 164,
      "declaredFileCount": 164,
      "duplicateEntryCount": 0,
      "everyByteCountMatched": true,
      "everySha256Matched": true,
      "extraFileCount": 0,
      "missingFileCount": 0,
      "selfEntryCount": 0,
      "status": "passed"
    },
    "runId": "run_88ee582c93cd",
    "taskId": "task_e723335e3bb8",
    "workerReport": {
      "path": "worker-report.md",
      "sha256": "5cb262c23a5b6ee03b278de1aed7d1a28de3b25392f6f680e38936845fe92081"
    }
  },
  "faultContract": {
    "initialization": {
      "contractOutcome": "UseWebFallback-eligible",
      "failureStage": "ArtifactIntegrity",
      "fallbackExecutionClaimed": false,
      "interpretation": "The accepted runner schema has no explicit UseWebFallback field; no host fallback execution was claimed.",
      "resolvedBackend": false,
      "selectionCode": "adapter_or_artifact_unavailable"
    },
    "postReady": {
      "backendRecreationObserved": false,
      "backendSwitchObserved": false,
      "contractOutcome": "InferenceError-style",
      "failureStage": "inference",
      "resolvedBackendRetained": true,
      "selectionCode": "invalid_tensor_bytes"
    },
    "source": {
      "path": "fault-fallback-summary.json",
      "sha256": "3c23a7fc9747a05f776bd304ae979227e9d7243ee5ec6a66de6c210bcc8e307e"
    },
    "status": "observations-match-contract-boundaries"
  },
  "goldenComparison": {
    "coordinateMapping": "multiply attributes 0..3 by 640 to reverse the official Ultralytics LiteRT _NormalizeCoords wrapper",
    "fixtures": [
      {
        "beforeNmsCount": 0,
        "decodedComparison": {
          "anchorMismatchCount": 0,
          "classMismatchCount": 0,
          "countMismatch": false,
          "maximumConfidenceAbsolute": 0.0,
          "maximumDecodedBboxAbsolute": 0.0,
          "minimumBboxIou": null
        },
        "decodedCount": 0,
        "determinism": {
          "exact": true,
          "rawDeviceSha256": [
            "0884ad63436a38d6214d51d00155dcc785bfbe45bd9eed5ad28d58bc55b66f6a",
            "0884ad63436a38d6214d51d00155dcc785bfbe45bd9eed5ad28d58bc55b66f6a"
          ],
          "runs": 2
        },
        "fixtureId": "no-detection",
        "mappedRawSha256": "bb63e05498d5e6ce81ef4a89dd27258ccf3b6b8c725ad2725ebf7dbf05a8a35b",
        "mismatches": [],
        "rawComparison": {
          "maxAbsolute": 0.0015869140625,
          "maxAbsoluteLocation": [
            0,
            2,
            8351
          ],
          "maxRelative": 4.391966819763184,
          "maxRelativeLocation": [
            0,
            66,
            6061
          ],
          "mismatchCount": 0,
          "nearZeroPolicy": {
            "absoluteToleranceOnly": true,
            "count": 23422,
            "threshold": 1e-12
          }
        },
        "webDecodedCount": 0,
        "webRawSha256": "0925949c09194116b3afa6c3ff174ea0df8722103cecd66a4c00f60770ee399c"
      },
      {
        "beforeNmsCount": 9,
        "decodedComparison": {
          "anchorMismatchCount": 0,
          "classMismatchCount": 0,
          "countMismatch": false,
          "maximumConfidenceAbsolute": 3.569931030789064e-07,
          "maximumDecodedBboxAbsolute": 9.196268602185143e-08,
          "minimumBboxIou": 0.9999996774706684
        },
        "decodedCount": 1,
        "determinism": {
          "exact": true,
          "rawDeviceSha256": [
            "5f21248b82cd5370d310da7bdb149b868239fffb9e95495134f3b274e6d56a16",
            "5f21248b82cd5370d310da7bdb149b868239fffb9e95495134f3b274e6d56a16"
          ],
          "runs": 2
        },
        "fixtureId": "single-target",
        "mappedRawSha256": "d634afeb859f8a17c95adc81f0f0e3d5ab63a32370176aae496dfca94f3ccbaa",
        "mismatches": [],
        "rawComparison": {
          "maxAbsolute": 0.002166748046875,
          "maxAbsoluteLocation": [
            0,
            2,
            8047
          ],
          "maxRelative": 4.278779029846191,
          "maxRelativeLocation": [
            0,
            13,
            4135
          ],
          "mismatchCount": 0,
          "nearZeroPolicy": {
            "absoluteToleranceOnly": true,
            "count": 64020,
            "threshold": 1e-12
          }
        },
        "webDecodedCount": 1,
        "webRawSha256": "37cc9955c15f1c4283fd2ed0d8aa360905357fd03a386db3a526d94dd0cca212"
      },
      {
        "beforeNmsCount": 48,
        "decodedComparison": {
          "anchorMismatchCount": 0,
          "classMismatchCount": 0,
          "countMismatch": false,
          "maximumConfidenceAbsolute": 1.137239227289033e-06,
          "maximumDecodedBboxAbsolute": 1.9677545026741683e-07,
          "minimumBboxIou": 0.9999991741265476
        },
        "decodedCount": 5,
        "determinism": {
          "exact": true,
          "rawDeviceSha256": [
            "af87e2fe53c08b4e4c76573fbf6e01c7db2d20184eb10dbfbc5ef835a8836314",
            "af87e2fe53c08b4e4c76573fbf6e01c7db2d20184eb10dbfbc5ef835a8836314"
          ],
          "runs": 2
        },
        "fixtureId": "multi-class",
        "mappedRawSha256": "f9b48d582eee457e00b7dd05118c91ca6311a26db9388c2da505b7ddce40ad2e",
        "mismatches": [],
        "rawComparison": {
          "maxAbsolute": 0.00201416015625,
          "maxAbsoluteLocation": [
            0,
            2,
            6826
          ],
          "maxRelative": 4.291727542877197,
          "maxRelativeLocation": [
            0,
            50,
            242
          ],
          "mismatchCount": 0,
          "nearZeroPolicy": {
            "absoluteToleranceOnly": true,
            "count": 76470,
            "threshold": 1e-12
          }
        },
        "webDecodedCount": 5,
        "webRawSha256": "5a9430616fc356b950326b9695aa067a1d5e7bf9b8341ae2ccc974fe35e8f6b0"
      },
      {
        "beforeNmsCount": 46,
        "decodedComparison": {
          "anchorMismatchCount": 0,
          "classMismatchCount": 0,
          "countMismatch": false,
          "maximumConfidenceAbsolute": 8.349082183944923e-07,
          "maximumDecodedBboxAbsolute": 1.320935548859703e-07,
          "minimumBboxIou": 0.9999990222415206
        },
        "decodedCount": 5,
        "determinism": {
          "exact": true,
          "rawDeviceSha256": [
            "310d1e1f11d195266bcc6e87ccd84e9bb5b115f2a785ecdbcf4f54828d3097f5",
            "310d1e1f11d195266bcc6e87ccd84e9bb5b115f2a785ecdbcf4f54828d3097f5"
          ],
          "runs": 2
        },
        "fixtureId": "boundary-box",
        "mappedRawSha256": "5081ad04d59f47019121186af7a72533d540088d59e7240e072a030eb66b6bd3",
        "mismatches": [],
        "rawComparison": {
          "maxAbsolute": 0.002105712890625,
          "maxAbsoluteLocation": [
            0,
            2,
            6826
          ],
          "maxRelative": 4.296241283416748,
          "maxRelativeLocation": [
            0,
            70,
            6004
          ],
          "mismatchCount": 0,
          "nearZeroPolicy": {
            "absoluteToleranceOnly": true,
            "count": 75796,
            "threshold": 1e-12
          }
        },
        "webDecodedCount": 5,
        "webRawSha256": "693f67016b64e244853a3b73db60700ad30df89c4b0e00a215a285d0df6bc4b5"
      },
      {
        "beforeNmsCount": 8,
        "decodedComparison": {
          "anchorMismatchCount": 0,
          "classMismatchCount": 0,
          "countMismatch": false,
          "maximumConfidenceAbsolute": 4.189479064775625e-07,
          "maximumDecodedBboxAbsolute": 2.4541931153976293e-08,
          "minimumBboxIou": 0.9999993026392707
        },
        "decodedCount": 1,
        "determinism": {
          "exact": true,
          "rawDeviceSha256": [
            "15532cd904c1e1ca3196986ebbd3ba5fa3b2f47f4f3eb994fcaff52f839fffca",
            "15532cd904c1e1ca3196986ebbd3ba5fa3b2f47f4f3eb994fcaff52f839fffca"
          ],
          "runs": 2
        },
        "fixtureId": "extreme-aspect",
        "mappedRawSha256": "270b76004c8ccecd7f0a963b807659ffae27ec6171af2f45966765301d785969",
        "mismatches": [],
        "rawComparison": {
          "maxAbsolute": 0.002655029296875,
          "maxAbsoluteLocation": [
            0,
            2,
            8070
          ],
          "maxRelative": 4.217672348022461,
          "maxRelativeLocation": [
            0,
            46,
            6602
          ],
          "mismatchCount": 0,
          "nearZeroPolicy": {
            "absoluteToleranceOnly": true,
            "count": 82441,
            "threshold": 1e-12
          }
        },
        "webDecodedCount": 1,
        "webRawSha256": "355d3d29fcfbe31fd93480a5697a5b34cd5d153a116629ab77304c508301e686"
      }
    ],
    "frozenReference": {
      "path": "evidence/golden/web-reference.json",